Field_ID	dtype	Examples
ann_sample	category	"Macrophages_SC31, Macrophages_SC31D, Innate lymphoid cell NK_SC31, Macrophages_SC14, AT2_SC31D, Lymphatic EC mature_SC31D, B cell lineage_SC31, Innate lymphoid cell NK_SC14, T cell lineage_SC31D, Dendritic cells_SC31, Mast cells_SC31, T cell lineage_SC14, Basal_SC31, B cell lineage_SC31D, AT2_SC31, T cell lineage_SC31, Smooth muscle_SC14, Monocytes_SC31, B cell lineage_SC14, EC capillary_SC31D, Secretory_SC31D, Monocytes_SC31D, Innate lymphoid cell NK_SC31D, Basal_SC31D, Monocytes_SC14, Multiciliated lineage_SC31D, Dendritic cells_SC31D, AT1_SC31, EC venous_SC31D, Secretory_SC14, EC arterial_SC31D, Lymphatic EC mature_SC31, Multiciliated lineage_SC31, Fibroblasts_SC14, Fibroblasts_SC31D, EC venous_SC31, Mast cells_SC31D, Secretory_SC31, Fibroblasts_SC31, Smooth muscle_SC31, EC capillary_SC14, EC capillary_SC31, EC arterial_SC31, EC arterial_SC14, Smooth muscle_SC31D, AT2_SC14, Hematopoietic stem cells_SC31, Dendritic cells_SC14, Multiciliated lineage_SC14, EC venous_SC14, AT1_SC31D, Lymphatic EC mature_SC14, Fibroblasts_WTDAtest7732270, Macrophages_WTDAtest7732265, T cell lineage_HCATisStab7732262, Fibroblasts_WTDAtest7732269, Lymphatic EC mature_WTDAtest7732266, Lymphatic EC mature_WTDAtest7732265, Basal_WTDAtest7732266, EC capillary_WTDAtest7732269, NA_WTDAtest7732265, NA_WTDAtest7732267, Unknown_WTDAtest7732265, Multiciliated lineage_WTDAtest7732266, Unknown_WTDAtest7732270, Unknown_WTDAtest7732269, Lymphatic EC mature_WTDAtest7732269, Fibroblasts_WTDAtest7732267, Myofibroblasts_WTDAtest7732269, Innate lymphoid cell NK_WTDAtest7732265, Innate lymphoid cell NK_HCATisStab7732264, AT2_HCATisStab7732261, Macrophages_WTDAtest7732269, AT2_HCATisStab7732264, EC capillary_WTDAtest7732270, AT1_WTDAtest7732270, T cell lineage_HCATisStab7732263, NA_WTDAtest7732268, Fibroblasts_HCATisStab7732263, AT1_WTDAtest7887999, EC arterial_WTDAtest7732268, T cell lineage_HCATisStab7732261, Mast cells_WTDAtest7732265, Fibroblasts_WTDAtest7732268, Unknown_WTDAtest7732266, B cell lineage_WTDAtest7732265, Secretory_WTDAtest7732266, T cell lineage_WTDAtest7732267, Fibroblasts_WTDAtest7732265, EC arterial_WTDAtest7732270, B cell lineage_HCATisStab7732262, Monocytes_WTDAtest7732265, Basal_WTDAtest7732269, Monocytes_WTDAtest7888002, EC capillary_HCATisStab7732264, Secretory_HCATisStab7732262, EC capillary_WTDAtest7732265, AT2_WTDAtest7887999, Myofibroblasts_HCATisStab7732264, T cell lineage_WTDAtest7732265, NA_HCATisStab7732264, B cell lineage_HCATisStab7732264, EC arterial_HCATisStab7732264, Basal_WTDAtest7732267, Basal_WTDAtest7732270, AT2_WTDAtest7888000, Unknown_HCATisStab7732262, EC arterial_WTDAtest7732265, EC capillary_WTDAtest7732267, Macrophages_WTDAtest7732268, EC venous_WTDAtest7732270, Monocytes_HCATisStab7732262, Myofibroblasts_WTDAtest7732266, Monocytes_HCATisStab7732263, Mast cells_HCATisStab7732264, B cell lineage_WTDAtest7732266, Secretory_WTDAtest7732269, Macrophages_HCATisStab7732261, EC capillary_WTDAtest7732266, Lymphatic EC differentiating_WTDAtest7732267, Multiciliated lineage_WTDAtest7732269, Monocytes_WTDAtest7732268, T cell lineage_WTDAtest7732269, Unknown_WTDAtest7732267, Mast cells_HCATisStab7732262, Multiciliated lineage_WTDAtest7732270, Unknown_HCATisStab7732263, Fibroblasts_HCATisStab7732264, Innate lymphoid cell NK_HCATisStab7732262, AT1_WTDAtest7732269, Macrophages_HCATisStab7732264, Innate lymphoid cell NK_WTDAtest7732268, Multiciliated lineage_WTDAtest7732267, AT1_WTDAtest7732268, NA_WTDAtest7732269, Monocytes_HCATisStab7732261, T cell lineage_WTDAtest7732270, NA_WTDAtest7732270, Macrophages_WTDAtest7888002, EC venous_WTDAtest7888002, AT2_WTDAtest7732269, Unknown_WTDAtest7732268, Unknown_HCATisStab7732261, Mast cells_WTDAtest7887999, Multiciliated lineage_WTDAtest7732265, Unknown_HCATisStab7732264, Myofibroblasts_WTDAtest7732265, Secretory_WTDAtest7732267, Mast cells_HCATisStab7732263, Lymphatic EC mature_WTDAtest7732270, Macrophages_HCATisStab7732262, Macrophages_WTDAtest7732270, Lymphatic EC mature_WTDAtest7888000, Monocytes_WTDAtest7732267, NA_WTDAtest7732266, Myofibroblasts_WTDAtest7732270, Lymphatic EC mature_WTDAtest7732268, Secretory_HCATisStab7732264, B cell lineage_WTDAtest7887999, EC venous_WTDAtest7732267, EC venous_HCATisStab7732264, Smooth muscle FAM83D+_WTDAtest7732270, EC arterial_WTDAtest7732267, EC venous_HCATisStab7732263, Innate lymphoid cell NK_HCATisStab7732263, B cell lineage_HCATisStab7732261, EC venous_WTDAtest7732268, Macrophages_HCATisStab7732263, Multiciliated lineage_WTDAtest7888001, AT2_WTDAtest7732266, T cell lineage_WTDAtest7888002, Fibroblasts_WTDAtest7888000, Innate lymphoid cell NK_HCATisStab7732261, Innate lymphoid cell NK_WTDAtest7887999, Lymphatic EC mature_HCATisStab7732264, Fibroblasts_HCATisStab7732262, Dendritic cells_WTDAtest7732265, Multiciliated lineage_HCATisStab7732264, B cell lineage_HCATisStab7732263, Innate lymphoid cell NK_WTDAtest7732267, T cell lineage_WTDAtest7732266, AT2_WTDAtest7732270, Secretory_WTDAtest7732270, B cell lineage_WTDAtest7732270, Basal_WTDAtest7732265, Macrophages_WTDAtest7732266, Secretory_WTDAtest7732265, Monocytes_WTDAtest7887999, EC capillary_WTDAtest7888001, Innate lymphoid cell NK_WTDAtest7888002, Innate lymphoid cell NK_WTDAtest7732266, Monocytes_HCATisStab7732264, Mast cells_WTDAtest7888002, Secretory_HCATisStab7732261, AT1_WTDAtest7888000, Dendritic cells_WTDAtest7732268, Lymphatic EC mature_WTDAtest7732267, Secretory_WTDAtest7888001, EC venous_WTDAtest7732265, Lymphatic EC mature_HCATisStab7732261, Fibroblasts_WTDAtest7888001, SM activated stress response_WTDAtest7732270, Unknown_WTDAtest7887999, AT2_HCATisStab7732262, B cell lineage_WTDAtest7732267, EC arterial_WTDAtest7732266, Macrophages_WTDAtest7887999, Macrophages_WTDAtest7732267, Lymphatic EC mature_HCATisStab7732263, SM activated stress response_WTDAtest7732267, Lymphatic EC mature_WTDAtest7888001, Lymphatic EC differentiating_WTDAtest7732269, Basal_HCATisStab7732264, Myofibroblasts_HCATisStab7732261, EC arterial_WTDAtest7732269, EC capillary_WTDAtest7732268, Basal_WTDAtest7732268, Dendritic cells_HCATisStab7732263, Myofibroblasts_HCATisStab7732263, Dendritic cells_HCATisStab7732264, AT1_HCATisStab7732264, Unknown_WTDAtest7888002, Secretory_HCATisStab7732263, Fibroblasts_HCATisStab7732261, Lymphatic EC differentiating_WTDAtest7732270, AT2_WTDAtest7888001, Lymphatic EC differentiating_WTDAtest7732268, T cell lineage_WTDAtest7887999, Submucosal Secretory_WTDAtest7732267, Unknown_WTDAtest7888001, Rare_HCATisStab7732264, EC venous_HCATisStab7732261, Multiciliated lineage_WTDAtest7888000, AT2_HCATisStab7732263, Dendritic cells_HCATisStab7732261, Smooth muscle FAM83D+_WTDAtest7732268, EC venous_WTDAtest7732269, Smooth muscle FAM83D+_HCATisStab7732264, Unknown_WTDAtest7888000, Dendritic cells_WTDAtest7732270, AT1_WTDAtest7888001, EC capillary_HCATisStab7732262, Secretory_WTDAtest7888002, Multiciliated lineage_HCATisStab7732262, Myofibroblasts_WTDAtest7732267, Basal_WTDAtest7888001, Dendritic cells_WTDAtest7732266, Monocytes_WTDAtest7732266, Mast cells_HCATisStab7732261, Smooth muscle FAM83D+_WTDAtest7732269, Secretory_WTDAtest7888000, Multiciliated lineage_WTDAtest7732268, EC venous_WTDAtest7732266, Myofibroblasts_HCATisStab7732262, B cell lineage_WTDAtest7888001, EC capillary_HCATisStab7732261, EC capillary_HCATisStab7732263, Dendritic cells_WTDAtest7888001, Fibroblasts_WTDAtest7888002, Mast cells_WTDAtest7732267, Mast cells_WTDAtest7732268, Smooth muscle FAM83D+_WTDAtest7732267, Lymphatic EC mature_WTDAtest7888002, EC arterial_WTDAtest7888000, EC arterial_HCATisStab7732263, EC venous_HCATisStab7732262, Smooth muscle FAM83D+_WTDAtest7732265, NA_WTDAtest7887999, EC venous_WTDAtest7888000, Innate lymphoid cell NK_WTDAtest7888000, Dendritic cells_WTDAtest7732267, Mast cells_WTDAtest7732270, EC capillary_WTDAtest7888002, Innate lymphoid cell NK_WTDAtest7888001, Lymphatic EC mature_WTDAtest7887999, EC arterial_HCATisStab7732262, EC capillary_WTDAtest7887999, EC capillary_WTDAtest7888000, Fibroblasts_WTDAtest7887999, Lymphatic EC differentiating_WTDAtest7732266, NA_HCATisStab7732263, Myofibroblasts_WTDAtest7732268, Basal_WTDAtest7888002, Lymphatic EC differentiating_HCATisStab7732263, Innate lymphoid cell NK_WTDAtest7732269, Macrophages_WTDAtest7888001, EC arterial_WTDAtest7888002, Dendritic cells_WTDAtest7888002, Dendritic cells_WTDAtest7887999, EC arterial_WTDAtest7888001, NA_HCATisStab7732261, Lymphatic EC differentiating_HCATisStab7732264, Monocytes_WTDAtest7732270, B cell lineage_WTDAtest7888002, Lymphatic EC differentiating_WTDAtest7888000, Secretory_WTDAtest7887999, NA_WTDAtest7888000, SM activated stress response_HCATisStab7732264, Macrophages_WTDAtest7888000, Submucosal Secretory_WTDAtest7732266"
size	float64	"1.0, 29.0, 30.0, 33.0, 34.0, 28.0, 27.0, 31.0, 26.0, 35.0"
is_primary_data	category	nan
datasets	category	"Lafyatis_Rojas_2019_10Xv1, Meyer_2021_3prime, Schultze_unpubl, Duong_lungMAP_unpubl, Seibold_2020_10Xv3, Lafyatis_2019, Teichmann_Meyer_2019, Sun_2020_batch4, Seibold_2020_10Xv2, Sun_2020_batch2, Lambrechts_2021, Sun_2020_batch3, Schiller_2021, Budinger_2020, Wunderink_2021_cryo, Banovich_Kropski_2020, Gomperts_2021_CSMC, Zhang_2021, Regev_2021_Cryo, Misharin_Budinger_2018, Janssen_2020, Kaminski_2020, Misharin_2021, Jain_Misharin_2021_10Xv2, Thienpont_2018_10Xv1, Eils_2020, Sims_2019, Sun_2020_batch1, Regev_2021_Fresh, Krasnow_2020, Nawijn_2021, Thienpont_2018_10Xv2, Lafyatis_Rojas_2019_10Xv2, Xu_2020_LAM1_3, Barbry_Leroy_2020, MeyerNikolic_unpubl_UCL, Meyer_2019, Jain_Misharin_2021_10Xv1, Peer_Massague_2020, Wunderink_2021_fresh, Schiller_2020, Sheppard_2020, Gomperts_2021_CFF, Meyer_2021_5prime, Regev_2021_Nuclei, Gomperts2021_UCLA, Shalek_2018, Tata_unpubl"
transf_ann_level_1_label	category	"nan, Stroma, Immune, Endothelial, Epithelial"
transf_ann_level_2_label	category	"nan, Fibroblast lineage, Myeloid, Lymphoid, Lymphatic EC, Airway epithelium, Blood vessels, Smooth muscle, Alveolar epithelium, Submucosal Gland, Mesothelium"
transf_ann_level_3_label	category	"nan, Fibroblasts, Macrophages, T cell lineage, Lymphatic EC mature, Basal, EC capillary, 2_Smooth muscle, EC arterial, Multiciliated lineage, Myofibroblasts, Innate lymphoid cell NK, AT2, AT1, Mast cells, Secretory, B cell lineage, Monocytes, EC venous, Lymphatic EC differentiating, Smooth muscle FAM83D+, Dendritic cells, SM activated stress response, Submucosal Secretory, Rare, 2_Mesothelium, 2_Hematopoietic stem cells"
transf_ann_level_4_label	category	"nan, Alveolar fibroblasts, Interstitial macrophages, Alveolar macrophages, CD8 T cells, CD4 T cells, Pericytes, Adventitial fibroblasts, 3_Lymphatic EC mature, Suprabasal, EC aerocyte capillary, EC general capillary, 2_Smooth muscle, 3_EC arterial, Multiciliated, 3_Myofibroblasts, NK cells, 3_AT2, 3_AT1, 3_Mast cells, Plasma cells, Club, Transitional Club-AT2, B cells, Classical monocytes, Basal resting, EC venous pulmonary, EC venous systemic, 3_Lymphatic EC differentiating, 3_Smooth muscle FAM83D+, AT2 proliferating, DC2, Non-classical monocytes, 3_SM activated stress response, DC1, SMG serous, Ionocyte, Goblet, SMG mucous, SMG duct, Neuroendocrine, Peribronchial fibroblasts, Deuterosomal, Migratory DCs, Hillock-like, Tuft, T cells proliferating, Plasmacytoid DCs, Subpleural fibroblasts, 2_Mesothelium, 2_Hematopoietic stem cells"
transf_ann_level_5_label	category	"nan, 4_Alveolar fibroblasts, Monocyte-derived Mph, 4_Alveolar macrophages, 4_CD8 T cells, 4_CD4 T cells, 4_Pericytes, 4_Adventitial fibroblasts, 3_Lymphatic EC mature, 4_Suprabasal, 4_EC aerocyte capillary, 4_EC general capillary, 2_Smooth muscle, 3_EC arterial, 4_Classical monocytes, Interstitial Mph perivascular, Multiciliated (non-nasal), 3_Myofibroblasts, 4_NK cells, 3_AT2, 3_AT1, 3_Mast cells, 4_Plasma cells, Club (non-nasal), pre-TB secretory, 4_B cells, 4_Basal resting, 4_EC venous pulmonary, 4_EC venous systemic, 3_Lymphatic EC differentiating, 3_Smooth muscle FAM83D+, 4_AT2 proliferating, 4_DC2, 4_Non-classical monocytes, 3_SM activated stress response, 4_DC1, SMG serous (bronchial), 4_Ionocyte, Goblet (bronchial), Goblet (nasal), AT0, 4_SMG mucous, 4_SMG duct, 4_Neuroendocrine, 4_Peribronchial fibroblasts, Alveolar Mph proliferating, Club (nasal), Alveolar Mph CCL3+, 4_Deuterosomal, Goblet (subsegmental), 4_Migratory DCs, 4_Hillock-like, 4_Tuft, 4_T cells proliferating, 4_Plasmacytoid DCs, 4_Subpleural fibroblasts, 2_Mesothelium, Alveolar Mph MT-positive, 2_Hematopoietic stem cells, SMG serous (nasal), Multiciliated (nasal)"