Field_ID	dtype	Examples
age_range	category	"nan, 30-35, 50-55, 40-45, 55-60, 60-65, 65-70"
ann_finest_level	category	"Monocyte-derived Mph, Alveolar macrophages, NK cells, Alveolar Mph CCL3+, AT2, Lymphatic EC mature, B cells, CD8 T cells, CD4 T cells, DC2, Mast cells, Suprabasal, Smooth muscle, Classical monocytes, EC general capillary, pre-TB secretory, Multiciliated (non-nasal), AT1, EC venous pulmonary, EC arterial, Adventitial fibroblasts, Alveolar fibroblasts, Hematopoietic stem cells, Unknown, Pericytes, EC aerocyte capillary, Myofibroblasts, Plasma cells, Basal resting, Interstitial Mph perivascular, EC venous systemic, Lymphatic EC differentiating, Smooth muscle FAM83D+, AT2 proliferating, Non-classical monocytes, SM activated stress response, DC1, SMG mucous, Ionocyte, SMG duct, Neuroendocrine, Club (non-nasal), Goblet (nasal), Hillock-like, Tuft, Club (nasal), Goblet (bronchial), Multiciliated (nasal), Alveolar Mph proliferating, SMG serous (bronchial), Subpleural fibroblasts, Lymphatic EC proliferating, Mesothelium, AT0, T cells proliferating, Deuterosomal, Migratory DCs, Plasmacytoid DCs, Peribronchial fibroblasts, Alveolar Mph MT-positive, Goblet (subsegmental), SMG serous (nasal)"
ann_level_1	category	"Immune, Epithelial, Endothelial, Stroma, Unknown"
ann_level_2	category	"Myeloid, Lymphoid, Alveolar epithelium, Lymphatic EC, Airway epithelium, Smooth muscle, Blood vessels, Fibroblast lineage, Hematopoietic stem cells, Unknown, Submucosal Gland, Mesothelium"
ann_level_3	category	"Macrophages, Innate lymphoid cell NK, AT2, Lymphatic EC mature, B cell lineage, T cell lineage, Dendritic cells, Mast cells, Basal, None, Monocytes, EC capillary, Secretory, Multiciliated lineage, AT1, EC venous, EC arterial, Fibroblasts, Unknown, Myofibroblasts, Lymphatic EC differentiating, Smooth muscle FAM83D+, SM activated stress response, Submucosal Secretory, Rare, Lymphatic EC proliferating"
ann_level_4	category	"Interstitial macrophages, Alveolar macrophages, NK cells, None, B cells, CD8 T cells, CD4 T cells, DC2, Suprabasal, Classical monocytes, EC general capillary, Transitional Club-AT2, Multiciliated, EC venous pulmonary, Adventitial fibroblasts, Alveolar fibroblasts, Unknown, Pericytes, AT2 proliferating, EC aerocyte capillary, Plasma cells, Basal resting, EC venous systemic, Club, Non-classical monocytes, DC1, SMG mucous, Ionocyte, Goblet, SMG duct, Neuroendocrine, SMG serous, Hillock-like, Tuft, Subpleural fibroblasts, T cells proliferating, Deuterosomal, Migratory DCs, Plasmacytoid DCs, Peribronchial fibroblasts"
ann_level_5	category	"Monocyte-derived Mph, None, Alveolar Mph CCL3+, pre-TB secretory, Multiciliated (non-nasal), Unknown, AT0, Interstitial Mph perivascular, SMG serous (bronchial), Club (non-nasal), Goblet (nasal), Club (nasal), Goblet (bronchial), Multiciliated (nasal), Alveolar Mph proliferating, Alveolar Mph MT-positive, Goblet (subsegmental), SMG serous (nasal)"
core_or_extension	category	"core, extension"
lung_condition	category	"Healthy, Healthy (tumor adjacent), Systemic sclerosis-associated ILD, Pneumonia non-COVID, COVID-19, IPF, HP, Sarcoidosis, NSIP, ILD, CF, COVID-19 severe, COVID-19 moderate, Myositis-associated ILD, COPD, Squamous Cell Carcinoma, anti-CD3 anti-CD28 antibody stimulated, Lung adenocarcinoma, Large Cell Carcinoma, Pleiomorphic Carcinoma, Lymphangioleiomyomatosis, End-stage lung fibrosis, unknown etiology, Chronic rhinitis"
original_ann_level_1	category	"Immune, Epithelial, Endothelial, Proliferating cells, Stroma, nan, Unknown, Cancer"
original_ann_level_2	category	"Myeloid, Lymphoid, Alveolar epithelium, Lymphatic EC, None, Blood vessels, Airway epithelium, Fibroblast lineage, Smooth muscle, Submucosal Gland, nan, Granulocytes, Mesothelium, Chondrocytes, Megakaryocytic and erythroid"
original_ann_level_3	category	"Macrophages, None, AT2, B cell lineage, T cell lineage, Dendritic cells, Mast cells, Monocytes, Secretory, Multiciliated lineage, AT1, Fibroblasts, Innate lymphoid cell NK, Basal, EC capillary, Vascular smooth muscle, EC arterial, Myofibroblasts, EC venous, Submucosal Secretory, Rare, nan, Neutrophilic, BASCs, Erythrocytes, Airway smooth muscle, Bronchial Vessel 1, KRT5- KRT17+ epithelial, Mesothelial DEFB4A, Squamous, Bronchial Vessel 2, Fibromyocytes, Erythroblast"
original_ann_level_4	category	"Macrophages SPP1 high, Alveolar macrophages, None, Club, Multiciliated, Peribronchial fibroblasts, Alveolar fibroblasts, CD8 T cells, CD4 T cells, NKT cells, Pericytes, Adventitial fibroblasts, Gamma-delta T cells, AT2 proliferating, Suprabasal, EC aerocyte capillary, EC general capillary, Interstitial macrophages, Arterial Pulmonary, Basal proliferating, NK cells, Goblet, Plasma cells, B cells, Non-classical monocytes, Classical monocytes, SMG basal A, EC venous pulmonary, EC venous systemic, DC1, Arterial Systemic, DC2, SMG serous, SMG mucous, SMG duct, Neuroendocrine, nan, Transitional AT2, Secondary crest myofibroblast, KRT8 high basal, Proteasomal basal, SMG basal B, Tuft, Ionocyte, Basal resting, Activated myofibroblasts, Macrophages MARCO-, Deuterosomal, DC monocyte, Mph proliferating, Plasmacytoid DCs, Fibroblasts PLIN2+, T cells proliferating, Subpleural fibroblasts, Migratory DCs, Regulatory T cells, Langerin+ DC, ILCs, Basal activated, Basal TP63, Basal KRT13 cornified, Fibroblasts WIF1+ CHRM2+, SMG MUC5Blow DEFB1, Lipofibroblasts, Intermediate monocytes, AT2 homeostatic, AT2 activated, Mucous ciliated, EREG+ Dendritic, NKT cells proliferating, EC capillary intermediate 1, EC capillary intermediate 2, Signaling alveolar AT2, TREM2+ Dendritic, Hillock-like, DC activated, MAIT cells, Nerve-associated fibroblasts"
original_ann_level_5	category	"None, Alveolar Mph CCL3+, Interstitial Mph perivascular, Alveolar Mph MT-positive, CD8_TRM/EM, CD4 T cells EM, CD8_EM/EMRA, CD8 T cells EM, CD4T cells TRM, CD4 T cells naive, NK CD16, Memory B cells, Monocyte-derived Mph, NK CD56, nan, Interstitial Mph IDO1+, Alveolar Mph activated IFI27, Interstitial Mph FPR3+, Interstitial Mph CCL3+, Interstitial v AXL+, CD8 T cells naive, CD4 T cells ME, CD8 T cells ME, OLR1+ Classical Monocyte, Goblet (nasal), Multiciliated (nasal), Club (nasal), Multiciliated (non-nasal), NK dividing, NK CD11d, CD8 T cells TRM, Naive B cells, Plasmablasts"
original_ann_nonharmonized	category	"1 SPP1hi Macrophage, 0 FABP4hi Macrophage, 5 T-cell/NK cell, 6 AT2, 11 Lymphatic endothelial, 15 B-cell/plasma cell, 2 T-Cell, 10 Dendritic cell, 13 Mast cell, 14 Proliferating cell, 7 Fibroblast/SMC/pericyte, 3 FCN1hi monocyte, 4 Endothelial, 12 Club, 9 Ciliated Cell, 8 AT1, Fibro_peribronchial, Fibro_alveolar, Macro_alveolar, Macro_CHIT1, CD8_TRM/EM, CD4_EM/Effector, NKT, Muscle_pericyte_pulmonary, CD8_EM/EMRA, CD8_EM, CD4_TRM, Fibro_adventitial, gdT, CD4_naive/CM, Endothelia_Lymphatic, Basal, Endothelia_vascular_Cap_a, Endothelia_vascular_Cap_g, Muscle_smooth_pulmonary, Fibro_myofibroblast, Macro_intravascular, Ciliated, NK_CD16hi, AT2, AT1, MAIT, Endothelia_vascular_arterial_pulmonary, Mast_cell, Secretory_Goblet, B_memory, Secretory_Club, B_plasma_IgG, Monocyte_CD16, Monocyte_CD14, Suprabasal, Endothelia_vascular_venous_pulmonary, Endothelia_vascular_venous_systemic, B_plasma_IgA, NK_CD56bright, Dividing_Basal, DC_1, Endothelia_vascular_arterial_systemic, DC_2, SMG_Serous, Ionocyte_n_Brush, SMG_Mucous, SMG_Duct, Neuroendocrine, Muscle_smooth_arterial_systemic, Dendritic cells, T cells 1, Macrophages 1, Club cells, Doublet, mixed cells, NK cells, Monocytes, Erythrocytes, Ciliated cells, Macrophages 2, Neutrophils, AT2 cells, Plasma cells, Mast cells/Basophils, AT1 cells, B cells, Cycling macrophages, CD56 NK cells, Macrophages 3, Arterial EC, Matrix fibroblast 1, Monocyte, NK, Macrophage 1, Venous EC, Multiciliated 1, Club, Goblet, Myofibroblast, Matrix fibroblast 2, Lymphatic EC, CD4T, Plasma, B, DC, Neutrophil, Mast/Basal, Serous, Secondary crest myofib, Pericyte, Arterial smooth muscle, Macrophage 2, gCap, Capillary intermediate, aCap, AT1.AT2, Bronchoalveolar stem cell, CD8T, Multiciliated 2, AT1 diff, Venous smooth muscle, Mature.mucus.secretory, Proliferating.basal, Differentiating.basal, KRT8.high, SMG.basal.A, Proteasomal.basal, SMG.basal.B, Mucus.secretory, Mature.ciliated.B, Mature.ciliated.A, Tuft-like, SMG.secretory, PNEC, Ionocyte, NK cell, T cell, Macrophage, Myeloid, Cycling cell, Alveolar epithelium, Secretory cell, Endothelial cell, Stromal cell, Fibroblast, Arterial aerocyte, Lymphatics, Aerocyte, Granulocytes, B cell, Disease-associated stromal cell, Airway epithelium, HHIP+ AT2, Mast, Smooth muscle cell, Venous endothelial cell, Luminal_Macrophages, T and NK, Mesothelium, Fibroblasts, Type 2 alveolar, Endothelial, Ciliated 1, Smooth muscle, Lymphatic, Mast cells, Basal 2, Type_1_alveolar, Basal 1, alveolar type 1 cells, veins, Alveolar macrophages, lymphatics, matrix fibroblast 2, matrix fibroblast 1, AT1/AT2-like, chondrocytes, pericytes, myofibroblasts, monocytes, alveolar type 2 cells, Cap1, vascular smooth muscle, unclassified, mast cells, enucleated erythrocytes, Interstitial macrophages, airway smooth muscle, AT2/Club-like, goblet cells, club cells, T cells, basal cells, Cap2, ciliated cells, arteries, pulmonary neuroendocrine cells, bronchial vessel, dendritic cells, Md_macrophage, Plasma_cell, B_cell, Squamous_KRT13, Alveolar_macrophage, Inflammatory, Secretory, cDC, CD8_Tcell, CD4_Tcell, pDC, Natural CD4 T-cells, AM, AM activated, Memory/Effector CD8 T-cells, Proliferating cells, preAT-1 cells, Natural CD8 T-cells, AT-2 cells, mDC2, Cap-B_EC, Classical Monocytes, SMCs, Lym_EC, Lipofibroblast, Differentiating Ciliated cells, Cap-A_EC, Fibroblasts-2, SCARA5, Fibroblasts-4, Fibroblasts-3, Bronchial vessel, Endothelial-1, Smooth muscle-1, Macrophages, Fibroblasts-1, Smooth muscle-2, Mesothelial-1, Mesothelial-2, AT2-1, AT2-2, Transitional AT2, Capillary, Artery, MoAM-1, MoAM-2, MoAM-3, TRAM-3, DCs, Basal 3, TRAM-1, Endothelial-2, TRAM-2, MoAM-4, MoAM2, MoAM4, Mixed myeloid, DC1, Club, Basal cells, DC2, Migratory DC, MoAM3, CD8 prolif. T cells, CD8 cytotoxic T cells, Ionocytes, AT2, AT1 cells, TRAM1, TRAM2, CD4 cytotoxic T cells, CD8 cytotoxic TRM T cells, MoAM1, CD4 CM T cells, CD4 prolif. T cells, iNKT cells, Treg, Endothelial - CA4+ capillary, Proliferating, Monocyte-derived macrophage, Endothelial Cells, Differentiating Ciliated, Inflammatory monocyte, moDC, CD4, CD8/NKT, NK Cells, SCGB3A2+ SCGB1A1+, pDCs, cDCs, Secretory - SCGB1A1+/MUC5B+, Macrophage - SPP1+, Endothelial - arteriole, Endothelial - capillary, SCGB3A2+, MUC5B+, Lymphatic Endothelial Cells, MyoFB, FB - PLIN2+, cDC1, Secretory - SCGB1A1+/SCGB3A2+, Myofibroblasts, T Cells, B Cells, Proliferating Macrophages, Endothelial - venule, Endothelial - peribronchiolar, Alveolar macrophage"
reannotation_type	category	"Misannotated, Correctly annotated, Underannotated, nan"
sample	category	"SC31, SC31D, SC14, WTDAtest7732270, WTDAtest7732265, HCATisStab7732262, WTDAtest7732269, WTDAtest7732266, WTDAtest7732267, HCATisStab7732264, HCATisStab7732261, HCATisStab7732263, WTDAtest7732268, WTDAtest7887999, WTDAtest7888002, WTDAtest7888000, WTDAtest7888001, Pool_423, Pool_425, Pool_353, Pool_424, Pool_352, Pool_351, Pool_437, Pool_350, Pool_426, Pool_439, Pool_354, Pool_438, Pool_440, Pool_441, Duong_lungMAP_unpubl_sample_7, Duong_lungMAP_unpubl_sample_3, Duong_lungMAP_unpubl_sample_8, Duong_lungMAP_unpubl_sample_5, Duong_lungMAP_unpubl_sample_2, Duong_lungMAP_unpubl_sample_4, Duong_lungMAP_unpubl_sample_6, Duong_lungMAP_unpubl_sample_1, Duong_lungMAP_unpubl_sample_0, T90, T154, T164, T101, T166, T153, T165, T167, SSC 7, SSC 8, SSC 4, SSC 3, SSC 5, SSC 2, SSC 1, SSC 6, 7185213, 7239219, 7239220, 7239218, 7239217, 7239213, 7135920, 7135919, 7185212, 7119453, 7119452, GSM4906346, GSM4906354, GSM4906347, T89, T85, T137, T121, T120, T126, GSM4906350, GSM4906353, BAL019, BAL031, BAL035, BAL003, BAL038, BAL034, BAL027, BAL026, BAL028, BAL022, BAL018, BAL024, BAL009, BAL029, BAL023, BAL017, BAL032, BAL016, BAL021, BAL033, BAL015, BAL037, BAL010, BAL014, BAL039, BAL020, BAL002, BAL011, BAL001, BAL025, BAL036, BAL012, BAL040, BAL030, BAL013, GSM4906348, GSM4906349, GSM4906352, MUC24276, MUC28292, MUC28291, MUC28287, MUC28289, MUC28294, MUC24280, Sample_21, Sample_18, Sample_20, Sample_8, Sample_17, Sample_15, Sample_7, Sample_22, Sample_16, Sample_10, Sample_9, Sample_19, Wunderink2021_sample_14, Wunderink2021_sample_18, Wunderink2021_sample_15, Wunderink2021_sample_12, Wunderink2021_sample_17, Wunderink2021_sample_16, Wunderink2021_sample_13, Wunderink2021_sample_19, VUHD68, VUILD60, VUILD58, F01366, F01851, VUHD67, F02607, VUILD61, F01853, F02526, VUILD57, TILD015, F01157, F02617, VUILD62, VUILD59, VUHD101, F02524, F01874, TILD030, VUILD65, F02528, F01641, VUHD70, TILD010, F01365, F01607, VUHD66, F02613, TILD019, F02522, TILD028, F01494, VUILD63, F02092, F02611, F03045, F02730, F01639, TILD001, F01508, VUILD53, F01511, F01394, VUILD55, F01495, F01403, TILD006, VUILD48, F01483, VUILD54, F01367, VUILD64, F01513, F01692, F02992, F00409, F02509, F02609, F01506, F01869, cc05p, dd39p, KKD022N, cc02p, h18, cf019, KKD020N, KKCFFT32N, dd49p, dd09p, cc04p, KKD019N, cc01p, KKD023N, dd10p, KKD024N, S2, M2, S6, S5, HC3, S1, M1, S4, S3, HC1, HC2, M3, D8_3, D8_2, D3_1, D3_2, SC10, SSc-ILD_02, SSc-ILD_01, SC20, SC27, HP_01, IPF_02, IPF_01, SC29, SC24, Myositis-ILD_01, IPF_03, SC07, SC22, IPF_04, Cryobiopsy_01, SC18, PX7, PX2, PX8, PX1, PX9, PX4, PX5, PX3, PX10, PX6, 207CO, 133C-a, 178CO, 228I-a, 022C-b, 052CO-a, 186CO-b, 160C, 051I, 010I, 152CO-a, 193CO-b, 022I, 225I-b, 439C-b, 157I-a, 210CO, 218C-a, 465C, 098C-b, 8CO, 221I-a, 29I, 23CO, 022C-a, 222I-b, 388C, 063I-b, 49I-a, 177I, 59I, 145I-a, 138I-a, 49I-b, 051I-a, 179I, 192CO"
scanvi_label	category	"Macrophages, unlabeled, AT2, Lymphatic EC, B cell lineage, T cell lineage, Dendritic cells, Mast cells, Proliferating cells, Monocytes, Secretory, Ciliated, AT1, nan, Basal, Submucosal Secretory, Rare, Mesothelium, Fibroblast lineage, Smooth Muscle, Capillary, Arterial EC, Non-T/B cells, Venous, Squamous, Bronchial Vessel 1, Bronchial Vessel 2, Neutrophilic"
study	category	"Lafyatis_Rojas_2019, Meyer_2021, Schultze_unpubl, Duong_lungMAP_unpubl, Seibold_2020, Lafyatis_2019, Teichmann_Meyer_2019, Sun_2020, Lambrechts_2021, Schiller_2021, Budinger_2020, Wunderink_2021, Banovich_Kropski_2020, Gomperts_2021, Zhang_2021, Regev_2021, Misharin_Budinger_2018, Janssen_2020, Kaminski_2020, Misharin_2021, Jain_Misharin_2021, Thienpont_2018, Eils_2020, Sims_2019, Krasnow_2020, Nawijn_2021, Xu_2020, Barbry_Leroy_2020, Meyer_Nikolic_2022, Meyer_2019, Peer_Massague_2020, Schiller_2020, Sheppard_2020, Shalek_2018, Tata_unpubl"
tissue_sampling_method	category	"donor_lung, surgical_resection, lung_explant, donor_lung_cryopreserved, balf, autopsy, balf_cryopreserved, autopsy_cryopreserved, biopsy_cryopreserved, scraping, biopsy, brush"
cell_type	category	"elicited macrophage, alveolar macrophage, natural killer cell, type II pneumocyte, endothelial cell of lymphatic vessel, B cell, CD8-positive, alpha-beta T cell, CD4-positive, alpha-beta T cell, CD1c-positive myeloid dendritic cell, mast cell, respiratory basal cell, tracheobronchial smooth muscle cell, classical monocyte, capillary endothelial cell, epithelial cell of lower respiratory tract, ciliated columnar cell of tracheobronchial tree, type I pneumocyte, vein endothelial cell, pulmonary artery endothelial cell, fibroblast, alveolar type 1 fibroblast cell, hematopoietic stem cell, native cell, lung pericyte, alveolar type 2 fibroblast cell, myofibroblast cell, plasma cell, lung macrophage, stromal cell, non-classical monocyte, smooth muscle cell, conventional dendritic cell, mucus secreting cell, ionocyte, acinar cell, lung neuroendocrine cell, nasal mucosa goblet cell, respiratory hillock cell, brush cell of trachebronchial tree, club cell, bronchial goblet cell, mesothelial cell, epithelial cell of alveolus of lung, T cell, multi-ciliated epithelial cell, dendritic cell, tracheobronchial serous cell, plasmacytoid dendritic cell, bronchus fibroblast of lung, tracheobronchial goblet cell, serous secreting cell"
assay	category	"10x 3' v1, 10x 3' v2, Seq-Well, 10x 3' v3, 10x 5' v1, 10x 5' transcription profiling, 10x 5' v2, 10x 3' transcription profiling, Drop-seq"
disease	category	"normal, interstitial lung disease, pneumonia, COVID-19, pulmonary fibrosis, hypersensitivity pneumonitis, pulmonary sarcoidosis, non-specific interstitial pneumonia, cystic fibrosis, chronic obstructive pulmonary disease, squamous cell lung carcinoma, lung adenocarcinoma, lung large cell carcinoma, pleomorphic carcinoma, lymphangioleiomyomatosis, chronic rhinitis"
organism	category	Homo sapiens
sex	category	"male, female, unknown"
tissue	category	"lung parenchyma, lung, respiratory airway, nose"
self_reported_ethnicity	category	"European, Asian, unknown, African, American, admixed ancestry, Pacific Islander"
development_stage	category	"56-year-old human stage, 76-year-old human stage, 75-year-old human stage, 29-year-old human stage, 55-year-old human stage, 67-year-old human stage, 37-year-old human stage, 44-year-old human stage, 61-year-old human stage, 66-year-old human stage, 68-year-old human stage, 38-year-old human stage, 64-year-old human stage, 43-year-old human stage, 53-year-old human stage, fourth decade human stage, sixth decade human stage, fifth decade human stage, seventh decade human stage, newborn human stage, 31-year-old human stage, 10-year-old human stage, 59-year-old human stage, 27-year-old human stage, 23-year-old human stage, 57-year-old human stage, 35-year-old human stage, 3-year-old human stage, unknown, 21-year-old human stage, 81-year-old human stage, 62-year-old human stage, 72-year-old human stage, 65-year-old human stage, 71-year-old human stage, 48-year-old human stage, 70-year-old human stage, 41-year-old human stage, 34-year-old human stage, 30-year-old human stage, 36-year-old human stage, 25-year-old human stage, 40-year-old human stage, 69-year-old human stage, 54-year-old human stage, 49-year-old human stage, 42-year-old human stage, 47-year-old human stage, 58-year-old human stage, 15-year-old human stage, 22-year-old human stage, 63-year-old human stage, 52-year-old human stage, 45-year-old human stage, 46-year-old human stage, 79-year-old human stage, 50-year-old human stage, 51-year-old human stage, 18-year-old human stage, 26-year-old human stage, 24-year-old human stage, 33-year-old human stage, 2-year-old human stage, 7-year-old human stage, 1-month-old human stage, 14-year-old human stage, 12-month-old human stage, 5-year-old human stage, 3-month-old human stage, 4-year-old human stage, 11-month-old human stage, 16-year-old human stage, 12-year-old human stage, 6-month-old human stage, 9-year-old human stage, 73-year-old human stage, 77-year-old human stage, 60-year-old human stage, 20-year-old human stage"
ann	category	"Macrophages, Innate lymphoid cell NK, AT2, Lymphatic EC mature, B cell lineage, T cell lineage, Dendritic cells, Mast cells, Basal, Smooth muscle, Monocytes, EC capillary, Secretory, Multiciliated lineage, AT1, EC venous, EC arterial, Fibroblasts, Hematopoietic stem cells, Unknown, Myofibroblasts, Lymphatic EC differentiating, Smooth muscle FAM83D+, SM activated stress response, Submucosal Secretory, Rare, Lymphatic EC proliferating, Mesothelium"
